{
  "$schema": "https://json-schema.org/draft/2020-12/schema",
  "$id": "https://github.com/Justinvolved/Truvio.Commerce.Serializer.BaselineUpdater/editions/edition.schema.json",
  "title": "Truvio distribution edition manifest (editions/<name>.json)",
  "description": "Contract schema for editions/<name>.json (v3.0 Distribution, Phase 2). An edition is a named, gate-proven COMPOSITION: from a privileged base + an ordered list of additions (+ surfaces, sample data, themes). Additions bind ONLY to the base contract (layers/base/base.contract.json), NEVER to each other — a cross-addition dependency is a validation failure. Validated at the gate via Test-Json -SchemaFile with -ErrorAction Stop (a broken schema must THROW, never vacuously pass). Digit classes are written [0-9]: a backslash-d escape is invalid JSON. Layer references are '<name>@<semver>'; the gate resolves each to layers/<name>/ and checks the layer.json version equals the pinned semver (the ref is a claim the gate proves, never trusts).",
  "type": "object",
  "additionalProperties": false,
  "required": [
    "name",
    "from",
    "add"
  ],
  "properties": {
    "name": {
      "type": "string",
      "pattern": "^[a-z0-9-]+$",
      "description": "Edition identity. Reused in filesystem paths and release tags - lowercase letters, digits, and hyphen only (identifier-allowlist compatible). Must equal the editions/<name>.json basename."
    },
    "from": {
      "type": "string",
      "pattern": "^base@[0-9]+\\.[0-9]+\\.[0-9]+$",
      "description": "The privileged base layer this edition builds on, pinned as 'base@<semver>' (e.g. base@2.3.0). Exactly one base - every edition stands on the base contract. The gate resolves this to layers/base and checks layers/base/layer.json version == the pinned semver."
    },
    "add": {
      "type": "array",
      "items": {
        "type": "string",
        "pattern": "^[a-z0-9-]+@[0-9]+\\.[0-9]+\\.[0-9]+$"
      },
      "description": "Ordered list of ADDITIONS as '<layer>@<semver>' refs (feature / any non-base, non-surface, non-theme layer; the sample-data layer rides the sampleData toggle, never an add ref). Activation order is the array order; teardown is reverse. Each ref resolves to layers/<name>/ (version-checked). Every addition binds ONLY to the base contract - a ref to a layer that depends on another addition fails validation (belongs in the base contract or the plan is wrong). MAY be empty (a base-only edition adds nothing)."
    },
    "surfaces": {
      "type": "array",
      "items": {
        "type": "string",
        "pattern": "^[a-z0-9-]+@[0-9]+\\.[0-9]+\\.[0-9]+$"
      },
      "description": "OPTIONAL ordered list of SURFACE layer refs ('<name>@<semver>', kind surface) the edition carries - what a frontend leg needs (e.g. headless@2.3.0: headless content + itemtypes + repositories). Activated after add, torn down before add's reverse. Omit for editions with no extra frontend surface (the base ships the Swift storefront surface itself)."
    },
    "sampleData": {
      "type": "boolean",
      "description": "OPTIONAL (default false). When true the edition activates the sample-data layer: demo buyer/CSR identities (applied pre-host-start) AND the demo shop catalog + contract pricing (applied after the base deserialize) - the layer ships both as SQL under merge/_sql/. When false the edition is the empty-shop scaffold (no identities, zero catalog) - base-only sets this false."
    },
    "themes": {
      "type": "array",
      "items": {
        "type": "string",
        "pattern": "^[a-z0-9-]+$"
      },
      "description": "OPTIONAL theme names the edition applies (kind theme, disk-overlay-only per SPEC-06), resolved to layers/theme-<name>. These map to the harness config.themes.items entries by themeName. Each theme is apply+asserted after the DB composition, DB never reset (themes are a transient post-deserialize test state). The theme assert set includes the header menu-bar affordance probes (nav depth permitting - base.contract.json navDepth)."
    },
    "compatAxes": {
      "type": "array",
      "uniqueItems": true,
      "items": {
        "enum": [
          "dw",
          "apps",
          "swift"
        ]
      },
      "description": "OPTIONAL version axes this edition CLAIMS, and therefore accepts a hard failure on. The compat floors every layer inherits from base.contract.json are otherwise advisory: an unmet floor is a WARN, because a floor is a claim nobody measured. Naming an axis here escalates it to FAIL for this edition - the gate observes the host on that axis (dw: the platform version and ring off the deployed assembly; apps: the installed AddIn versions read from the Files/System/AddIns/Installed/<id>.<version> directory names; swift: the tag in files/System/Truvio/swift.stamp.json cross-checked against the shipped item-type set) and refuses to pass when the floor is not met. Same shape as the index-builder check's existing escalation, where a condition is a warning until an edition declares the promise it contradicts. Naming an axis the gate cannot observe on the target host is a configuration error, not a pass: an unnamed axis is exactly how a sideways failure gets through."
    },
    "criticalPaths": {
      "type": "array",
      "items": {
        "type": "string"
      },
      "description": "OPTIONAL edition-level frontend paths that must respond 2xx after the full composition is activated (the edition's own smoke set, on top of each layer's asserts). Enforced by the gate (one anonymous GET per path; PASS on 2xx, FAIL row otherwise - never silently skipped)."
    },
    "provenOn": {
      "type": "object",
      "additionalProperties": false,
      "required": [
        "swiftVersion",
        "gateRunId"
      ],
      "properties": {
        "swiftVersion": {
          "type": "string",
          "pattern": "^[0-9]+\\.[0-9]+\\.[0-9]+$",
          "description": "The Swift version the gate last proved this edition against."
        },
        "gateRunId": {
          "type": "string",
          "pattern": "^[0-9]{8}-[0-9]{6}$",
          "description": "The gate run id (runs/<ts>) that produced the proof - the same id carried into the annotated editions/<name>/<semver> tag."
        }
      },
      "description": "OPTIONAL attestation stamped by the gate on a PASS (never hand-authored as trusted): the swiftVersion + gate run id this edition was last proven against. Feeds the annotated editions/<name>/<semver> tag (Phase 3)."
    },
    "description": {
      "type": "string",
      "description": "OPTIONAL human-readable summary of what this edition composes and demonstrates."
    },
    "expectedCounts": {
      "type": "object",
      "additionalProperties": {
        "type": "integer",
        "minimum": 0
      },
      "description": "OPTIONAL row-count contract override/extension: table -> expected row count, merged over the sampleData-derived defaults (EcomProducts/EcomGroups/EcomCountries) by Set-ConfigFromEdition. Lets a page-free edition (base-only since the Swift 2.4 base split) carry DB-level framework asserts (e.g. EcomShops=1) in place of page smoke."
    }
  }
}
