{
  "name": "base-only",
  "from": "base@4.4.0",
  "add": [],
  "sampleData": false,
  "criticalPaths": [
    "/Admin/"
  ],
  "expectedCounts": {
    "EcomProducts": 0,
    "EcomGroups": 0,
    "EcomCountries": 96,
    "EcomShops": 1,
    "EcomPayments": 5,
    "EcomShippings": 17,
    "EcomOrderStates": 18,
    "EcomLanguages": 20,
    "EcomCurrencies": 169,
    "Page": 0,
    "Area": 1
  },
  "description": "Framework-only proof (base split, Swift 2.5): base alone - ZERO content areas, ZERO pages, ZERO catalog, no theme leg (nothing to skin). Smoke is API/DB-level: /Admin/ liveness + token auth + the framework row-count contract (shops/payments/shippings/order-states (18 since base 4.0.0: the 14 stock states plus the four quote states)/languages/currencies + 0/0/96 catalog-free counts + Page=0/Area=0). Not in layers/INDEX.json gateProven.editions: unproven until the Foundry publish flow stamps a gate run for it. INDEX gateProven is the record."
}
